"您为此书添加的 Kindle 笔记：",,,
"标注 (黄)","位置 1584","","请记住，当你的人生除了挣钱维持生活以外别无其他意义，而你发觉自己为此忧心忡忡时，请记住我和凯"
"标注 (黄)","位置 1610","","片桐老师说：“我们的目标是，一辈子时时刻刻都要对一切有知觉的存在怀抱善"
"标注 (黄)","位置 1673","","如果你坐下来，好好读读由布莱斯（R.H. Blyth）精译的芭蕉、子规、一茶和芜村等四大俳句名家的"
"标注 (黄)","位置 1694","","常念及生命无常 并不荒唐可笑 反而能让我们 活得更有生命力 更有现实感 并时时保持"
"标注 (黄)","位置 1715","","人生在世，偶尔应当疯狂一下，失控一下，用不同于平时的观点看问题，并了解到这世界并不是我们所以为的那样；世界并不扎实，并没有明显的结构，也不是不朽的。我们总有一天会死去，这一点是无法被左右"
"标注 (黄)","位置 1718","","事实上我们并不知道自己何时会死，我们希望能寿终正寝，但可能下一分钟就会丧生。常念及生命无常并不荒唐可笑，反而能让我们活得更有生命力，更有现时感，并时时保持"
"标注 (黄)","位置 1734","","铃木老师在《禅心，初始之心》中说：“管理人群的最上策，就是鼓励他们淘气。如此一来，他们便会受制于这种较宽广的知觉。给你的牛或羊一片广袤的牧草地，这才是管制牛羊的办法。”你也需要一片宽敞的写作场域。别太快扯缰绳，给自己庞大的漫游空间，做个彻底迷途的无名氏，然后重返故土，开口"
"标注 (黄)","位置 1741","","就像从事任何运动一样，为了让写作进步，你就得勤加练习。不过，不要只是盲目地定期练习，尽责了事。“是的，我今天已经写了一个小时，昨天也写了一个小时，前天也一个小时。”别光是把时间写满为止，这样还不够，你必须非常尽力。当你坐下习作时，应乐于把整副生命放进字里行间。不然的话，你只不过是机械性地推着笔横过纸上，并且不时地看一看时钟，看时间到了"
"标注 (黄)","位置 1754","","你将慢慢体会到自己的节奏──何时需要写、何时需要休息。这会让你和你自己的关系更加深刻，而不是盲目地依循"
"标注 (黄)","位置 1756","","她的那副模样我看了很难受，因为不管教书也好，洗衣烧饭也好，还是提笔写作也好，她都只是在尽尽责任"
"标注 (黄)","位置 1758","","一直以来，我们都被教导做人行事得守规矩，可是我们从未思考过这些规矩的价值"
"标注 (黄)","位置 1780","","感受当下的情境是很重要的，不要在事前即自我"
"标注 (黄)","位置 1781","","与其遵守规则，不如对众生心怀善念。立下规则是为保护事物不受伤害或滥用，只要心存良善，不必参考法规，自然而然也会"
"标注 (黄)","位置 1784","","勿设定规矩──“我每天都得写”──而后麻木地照章"
"标注 (黄)","位置 1785","","一旦你深入写作的天地，便无法抽身而出，宣告玩完之后，就回家“乖乖做人”，而且不讲实话。如果你在习作时下笔彻底坦诚，那么诚实的因子便会渗进你的生命"
"标注 (黄)","位置 1798","","当你什么都尝试过了——结婚、当嬉皮、云游四海、住在明尼苏达或纽约、教书、灵修——你终于接受写作是你的志业，你没有其他的路可走。所以，不管你有多么不情愿，总会有一天，总会有第二天，前头总是有写作这项工作。你不能指望天天都能写得很顺畅，事情不会是这样的。有一天可能顺利得不得了，生产力旺盛，但下一回提笔再写时，却丧气地直想报名上船，出海到沙特阿拉伯去算了。写作这件事是没个准的，你可能以为一口气写了三天，你终于创出自己的节奏；然而接下来的一天，唱片却跳了针，一路吱吱作响，讨厌"
"标注 (黄)","位置 1843","","我和丈夫分手时，片桐老师对我说：“你应该独自生活，应该熟悉那种状态，那是人最终的住所。” “老师，我会渐渐习惯寂寞吗？” “不，你不会渐渐习惯。我每天早上都冲冷水澡，而每天早上都被冷得吓一跳，可是我继续站在淋浴喷头底下。寂寞永远会咬噬人心，但是得学着挺身迎向它，别被"
"标注 (黄)","位置 2032","","我们都是佛，我看得出你是佛，但你并不相信我。等你看到自己是佛，就会醒觉了。那便是"
"标注 (黄)","位置 2041","","这世界承认它好，哪有我们自己承认它好来得重要。这是最要紧的一步，如此我们才会感到满足。我们很好，当我们写出好作品时，那是件好事。我们应当加以认可，并挺身拥护我们的"
"标注 (黄)","位置 2080","","因此，当你来到日本武士的天地，人就得变得强悍一点。不是要你变得残酷无情，而是要有面对真相的强悍作风。真相到头来并不会害人；真相使得这世界变得更清楚分明，诗句更光华"
"标注 (黄)","位置 2130","","这是赤裸裸的写作，是一个机会，让我们得以审视自己，显露自己的真实面貌，并且在不试图操纵、没有侵略性的情况下，接纳我们自己。“我不快乐”──别企图掩盖这个声明，如果那就是你的感想，不要作任何判断，接受它就是"
"标注 (黄)","位置 2168","","在我们临终前的那一刻，应该简简单单地道出我们的感想──“我不想死。”用不着愤怒、自责或自怜，而要 接受真实的"
"标注 (黄)","位置 2171","","尽管死神正在我们身后嚎叫，而生命在我们眼前翻转不休，我们都能提笔便写，去写我们不能不讲的"
"标注 (黄)","位置 2173","","任何事情 只要投入全副心力 便是一趟孤独的"
"标注 (黄)","位置 2181","","最大的挣扎并不是在真正提笔写的时候，而是得努力克服既怕成功又怕失败的恐惧心理。最后终于燃烧殆尽，只留下纯粹的"
"标注 (黄)","位置 2187","","明白这一点是很重要的。我们都以为成功能带来快乐，可是成功也可能带来寂寞、孤立和失望。成功可能带来任何东西，这句话有其道理。给自己空间，想怎么感觉便怎么感觉，可是不要觉得自己不应该拥有各式各样的"
"标注 (黄)","位置 2218","","对于这些理由，我从不以为意。说句不好听的，这些理由都是借口罢了。你想做成一件事，又害怕去面对它。在这么多年的 生活中，我发现很多人只是缺乏真心投入罢了。他们有过激情，却让激情自生自灭了。我从不听信这些理由，听一会儿我就烦了。就跟我自怨自艾一样，都让人受不了——都是“心猿”[3] 罢了。借口是什么，其实并不"
"标注 (黄)","位置 2229","","我们把生命中的很多名字都当成了借口——当成了我们不想去做事、畏惧开始的借口。总而言之，如果你想去写作，你就要闭紧嘴巴不再谈论这些借口，拿起笔开始写。我这些话可能说得很直白，有些伤人。但这就是我们的真实生活。我们需要大步向前。哪怕我们只能写10分钟，都是好的。只要拿起笔开始写，就胜过所有的"
"标注 (黄)","位置 2240","","有时候，只是我们心猿意马，让我们无法写下去。不要相信那些理由（"
"标注 (黄)","位置 2258","","你可以变成一个有意识、有心思的作家，先从知道身边每棵树、每种植物的名字做起，从观察阳光洒在汽车车身上的颜色做起。这些都可以从练习做起。如果你有写作天赋，那自然是人生幸事，但仅仅靠天赋是走不长久的。后天努力会让你走得"
"标注 (黄)","位置 2262","","我的写作一直是跟禅修、正念、静坐相关联"
"标注 (黄)","位置 2264","","对于我而言，写作和禅宗讲的“空性”[6] 是结合在一起的。你可以创作出属于自己的表达方式，你可以永远葆有创作的"
"标注 (黄)","位置 2281","","在写作训练中，你会把这些心念都抓住，然后把它们写出来。这个写作的过程，也是你不断追随自己心念的过程。当你的心念变成了一股涓涓细流，你正坐在溪流之中，那么心念也就不再像打坐时那样黏在脑袋中了。从某种意义上说，写作是一种更有效和方便的调心方式——我追逐我的心念，然后放它们一条生路。而无论我换到哪里去冥想打坐，都需要花很长的时间去给心念找一个出口，需要很长的时间去将它们消化。所以说，打坐冥想和写作训练是两种不同的方式。对我而言，写作是更深层次的禅"
"标注 (黄)","位置 2332","","艾伦跟我说：“当你的想法有条理了，你的写作才能够"
"标注 (黄)","位置 2350","","这就像如果你想成为一个跑步运动员，但觉得应该保持冥想。其实只要去做跑步训练就好了，只是更深层次的"
"标注 (黄)","位置 2355","","人活着，就面临着很多“失控”。比如坠入爱河，这就是一种失控；当我们的至亲至爱离世，我们又会面临一种巨大的失控。但写作的好处是，你可以暂时性陷入一种巨大的“空性”和“无我”状态中，然后当你放下笔，去外边散散步，你会从“无我”中跳脱出来，回到一个安全的自我模式，然后再继续进入“无我”的写作状态，循环往复。我想着这是东方文化带给西方社会的福音。当你得以进入一种冥想的状态，你会了悟空性，"
"标注 (黄)","位置 2389","","我能做到的是，如果我说“我每天要写作三小时”，那我就真的会去做到每天写作三"
