"您为此书添加的 Kindle 笔记：",,,
"写出我心:普通人如何通过写作表达自己",,,
"作者：娜塔莉·戈德堡(Natalie Goldberg)、 韩良忆、 袁小茶",,,
"免费 Kindle 极速预览：",,,
"http://z.cn/0sCU5Pj",,,
----------------------------------------------,,,
,,,
"批注类型","位置","已加星标？","批注"
"标注 (黄)","位置 222","","有人会买高价的硬皮记事本，庞大又笨重，而且因为本子外观精巧好看，你会以为非得在上头写些好文章才配。相反地，你应该觉得，就算在纸上写下全世界最烂的垃圾文字也没"
"标注 (黄)","位置 253","","1．手应当不停地写。（不要停下来重读你刚才写的那一行，那只是在拖时间，并在设法掌控你正在说的话。） 2．不要删除。（那是在编辑你写的东西，就算写出来的并不是你原本打算写的东西，也随它去。） 3．别担心拼错字、标点符号和文法。（甚至别去管是否把字写出了格子，或超出线。） 4．放松控制。 5．别思考，别想着要合乎逻辑。 6．直捣要害。（倘若你写出了可怕或太过赤裸裸的东西，那就一头钻进去，其中说不定蕴藏了很多"
"标注 (黄)","位置 260","","因为你的目标就是要竭尽所能回到初始的意念，回到能量未受社交礼节或内在压抑阻挠之处，回到你把心灵实际所见与所感都写出来的地方，而不是心灵以为它该见到或该有的"
"标注 (黄)","位置 263","","初始的意念藏有巨大的能量，呈现心灵对某件事物灵光一闪的最初反应。但内在的潜意识压抑往往会抑制它们，我们因而生活在第二手、第三手想法的世界里；思索再思索，再三地远离了和初始灵光的直接联系。比方说下面这句话──“我把喉咙上的雏菊割掉了”突然浮现心头，可是我受过一加一等于二逻辑训练的脑子，经过深思，基于礼貌、恐惧，加上对自然无矫饰的语言感到难为情，于是会这么说：“胡说八道，你听起来一副想自杀的样子。别让人见到你在割喉咙，人家会以为你是神经病。”如果我们听任潜意识的压抑发威，我们会写出：“我的喉咙有点痛，所以我什么话也没讲。”合宜但"
"标注 (黄)","位置 272","","坐禅时，你得把背挺直，双手置膝或置于身前，盘腿坐在叫做zafu的坐垫上，这个姿势名为“手印”（mudra）；你面对白墙， 留心自己的呼吸，不管心里感觉如何──心头洋溢龙卷风般的怒火和抗拒也好，还是像大雷雨般的喜悦与悲哀也好，你都得持续坐着，背挺直，面墙盘腿打坐。你学会一件事：不论内心的思潮或情感有多澎湃，都得不动如泰山。继续坐着，这便是得遵守的"
"标注 (黄)","位置 276","","写作亦是如此。当你接触初起的意念时，你必须当个伟大的斗士，从这些意念写起。特别是在一开头的时候，你可能会感到情感洋溢且能量充沛，因而难以自持，但切勿停笔。应持续用你的笔记录生命的细节，并洞悉这些细节的核心。在初级写作班上，常有学生读了自己方才所写的东西以后，痛哭失声。这无伤大雅，他们也常边写边哭。我鼓励他们透过泪眼阅读或写作，如此才能显现出另一面，而不再受情绪摆布。流泪时不要停下，勇往直前探究真相。这就是该守的"
"标注 (黄)","位置 282","","我有位信佛的朋友一次在打坐完以后说：“打坐后，色彩变得更鲜活了。”教她打坐的师父表示：“活在当下，世界才会真的活过"
"标注 (黄)","位置 287","","偶尔你会提不起劲，三里的路程，每一步都在抗拒，可是你还是勉为其难地跑了。有兴致也好，没兴致也罢，你都得练习，可不能坐等灵感来了，想跑的欲望涌现了，才开步前进。灵感和欲望绝对不会自动来报到，尤其当你身材已经变形，而且一直在逃避，更休想它们会来。然而倘若你定期跑步，训练自己的心志去适应，或不去理会那股抗拒的心情，你就是去跑，并且在跑到一半的时候，爱上了跑步。当你接近终点的时候，反而极不愿意停下脚步。一旦停步了，便渴望下一次的"
"标注 (黄)","位置 292","","写作亦是如此，你一旦埋首写作，便会纳闷，自己怎么会耽搁了那么久才终于坐在书桌前。经由练习，你确实得到进步；学会更加信赖深层的自我，并且不屈从于心底有意逃避写作的那个声音。有件事真是奇怪，那就是我们从来不会质疑足球队在一场比赛之前，是否应该花上好长一段时间练球，可是碰上写作这种事，我们却难得给自己练习的"
"标注 (黄)","位置 296","","尽量不对自己有所期许，坐在桌前，说：“我有写出世上最烂的垃圾的自由。”你必须给自己空间，没有目的，痛快地"
"标注 (黄)","位置 297","","要是你每一回一坐下，都期待着要写出伟大作品的话，写作带给你的，永远只有大大的失望。此外，那份期待也会让你迟迟无法"
"标注 (黄)","位置 301","","要是没达到理想，我会小心地不责难自己或慌张着急，没有人能事事符合"
"标注 (黄)","位置 307","","写作练习的主要目的之一，就是学会信赖自己的心灵和身体，并培养耐性和不具侵略性的"
"标注 (黄)","位置 310","","写作的过程教我们保持神志"
"标注 (黄)","位置 322","","把写作练习想成是一双慈爱的臂膀，让你没有逻辑、没有来由，一心只想"
"标注 (黄)","位置 349","","了解这个过程，可培养人的耐性，并减少焦虑。我们无法控制每件事情，连自己要写的东西也掌握不了。在此同时，我们必须保持练习，我们不能以此为不写作的借口，而坐在沙发上吃"
"标注 (黄)","位置 378","","我们必须正视自己的惰性、缺乏安全感、自怨自艾，以及深恐自己根本没啥值得好说的那种"
"标注 (黄)","位置 381","","你面对一切，不逃之夭夭，就会感觉到自己逐渐拥有艺术的稳定性。如果你不害怕自己内在的声音，也就不会畏惧别人对你的批评"
"标注 (黄)","位置 453","","必须想出办法让自己动笔，否则，洗碗盘或随便什么能让你规避写作的事情，都会变成天底下最重要的大事。总之，闭嘴，坐下，写，就对了。这样做很痛苦，但写作是很单纯、基本且严苛的事，没什么有意思的小玩意儿能使它变得好玩"
"标注 (黄)","位置 457","","有段禅语说：“说话时便说话，行走时便行走，死亡时便死亡。”该写作时便写作，别让自己和内疚、控诉及暴力的威胁"
"标注 (黄)","位置 462","","印度瑜伽行者巴巴·哈里·达斯（Baba Hari Dass）说：“因为要学，所以"
"标注 (黄)","位置 473","","不妨使出各式各样无伤大雅的小伎俩，只是别陷入无止境的罪恶感、逃避和压力的恶性循环里。该写的时候到了，就写"
"标注 (黄)","位置 484","","那个声音晓得“乏味”二字会使你呆立原地，无法举步向前，因此你经常会听见自己用此二字嫌弃自个儿写的东西。把“你很乏味”当成远处微风吹动洗好的白衣服所发出的啪啪声。衣服终究会晒干，远方的某个人会把它们叠好并收进屋里。在此同时，你也将继续埋首"
"标注 (黄)","位置 500","","我试着活在当下，无所畏惧，开放心灵，当下的状态自会提供"
"标注 (黄)","位置 503","","心里一害怕，写作便会受影响，因而失真。“但是你有怕的理由啊！”错了，是先入为主的成见让人心存"
"标注 (黄)","位置 524","","片桐老师说：“能力好比是地表底下的水。”无人拥有这水，然而你可以汲取。你努力下工夫汲取，它终将归你"
"标注 (黄)","位置 528","","我们借着写来学写作，事情就是这么简单。求之于外，去找我们以为是写作专家的人，反而是学不会写作"
"标注 (黄)","位置 583","","我们不该想“这是个写作的好题材”，或“我们不应当谈这个”，而应该百无禁忌，无所羁绊。写作、生活和心灵是一体的，不可"
"标注 (黄)","位置 610","","写作时，把一切都放开，设法用简单的文字起个简单的头，表达内心深处的想法。一开始并不会很顺利，但就算力不从心也无所谓，你正在剥除自己一层层的外衣，正在暴露自己的生命；那并不是你的自我想要呈现于外的形象，却是你作为一个人的真实"
"标注 (黄)","位置 613","","如今，每当我脾气暴躁、心情恶劣、不满、悲观、消极、觉得什么都不对劲时，我会意识到这些都是当下的"
"标注 (黄)","位置 656","","我原本以为自由代表为所欲为。自由其实意味着知道自己是谁，在这世上应当做些什么，然后切实地去完成自己的"
"标注 (黄)","位置 733","","写作时也当如此：让写作来完成写作，让你自己消失。你只是在记录涓涓流过你身体的思绪"
"标注 (黄)","位置 737","","片桐老师有云：“文学能告诉你生活是什么面貌，却不能告诉你如何摆脱"
"标注 (黄)","位置 763","","时间是人类所拥有的十分宝贵的基本"
"标注 (黄)","位置 789","","呼吸到这股气息着实令人欢喜兴奋，因此最好记住下面这段话：想让自己感到酩酊醺然，别喝威士忌；大声朗读莎士比亚、丁尼荪、济慈、聂鲁达、霍普金斯、米雷、惠特曼，让你的身体高歌"
"标注 (黄)","位置 801","","歌唱有九成靠倾听，你得学会聆听。”只要你听得彻底，那乐音便会盈满你体内，所以当你一张开嘴巴，音乐便自然而然会从你体内流淌"
"标注 (黄)","位置 808","","倾听就是有容乃大，你听得越深刻，就会写得越好。你不带成见地接纳事物的本色，到了第二天，便可写出关乎事物本色的"
"标注 (黄)","位置 809","","杰克·凯鲁亚克曾列表说明散文写作的要素：“对万事万物皆怀抱恭谨，敞开心胸，倾心聆听。”他同时也说：“不要拽文作诗，要确切呈现事物的"
"标注 (黄)","位置 820","","十七世纪日本的俳句大师芭蕉曾说：“欲知一树，走向彼"
"标注 (黄)","位置 822","","日本禅宗大师道元说道：“走在雾中，会弄湿"
"标注 (黄)","位置 849","","作家有时会搞不清楚状况，以为写作给了我们活着的理由，而忘了活着是没有条件的，生活和写作乃是两个分开的"
"标注 (黄)","位置 867","","我们想要诚实无欺的支持和鼓励，一旦得到了，却又偏偏不相信，反而轻易听信苛责，以强化心底根深蒂固的一个想法，那就是其实我们根本不行，根本不会"
"标注 (黄)","位置 871","","有人赞美你时，真的请你住嘴，就算感觉很不好受、很不习惯，也请保持呼吸，倾听，让自己听进去那些话，感受那美妙的感觉。建构起接纳正面、诚挚支持的"
"标注 (黄)","位置 922","","片桐老师常说：“对一切有知觉的众生常怀善念。”我曾经问他：“有知觉的众生到底是什么？是有感觉的人和物吗？”他对我说，我们甚至必须对椅子、空气、纸张和街道怀有善念。人心必须变得如此宽阔有肚量。当佛陀在菩提树下悟道成佛时说：“我与众生皆成佛。”他并不是说“我成佛了而你没有”或“我看到佛了”，好像他归他，佛归佛"
"标注 (黄)","位置 983","","有关写作，有一句古老的箴言：“别光讲，展现"
"标注 (黄)","位置 983","","这话到底是什么意思？它的意思是，别光是告诉我们你很愤怒（或其他一些伟大的字眼，比如诚实、真理、憎恨、爱情、悲伤、生活、正义等），向我们展现是什么令你愤怒。我们阅读以后，也会觉得愤怒。别告诉读者该有什么感受，把状况展现给他们看，自然会唤起他们内心的"
"标注 (黄)","位置 1005","","这并不代表你不能写自己未亲身遭遇到的事情，而是说你务必在文中注入生命气息，否则的话，写出来的文字会虚无缥缈，看不见你这个人的"
"标注 (黄)","位置 1025","","磨亮你的觉察力，持续不辍：觉察名字、那一月、那一天，最终觉察到那"
"标注 (黄)","位置 1026","","威廉姆斯还说：“不要概念，而要具体的"
"标注 (黄)","位置 1072","","我们必须牢记，一切事物都是既平凡又不凡；事物平凡与否，全看我们的心灵是开放还是闭塞的。细节无所谓好或坏，它们就只是细节"
"标注 (黄)","位置 1081","","我们不光是为自己而活；人与人之间相互关联。我们为大地、为得州、为昨晚捐躯供我们食用的鸡、为我们的母亲、为公路、为天花板和树木而活。我们有责任善待自己，然后以同样的方式善待这个"
"标注 (黄)","位置 1084","","片桐老师说：“喝杯茶是件很深奥的"
"标注 (黄)","位置 1137","","最好当个部落作家，为所有的人写作，反映人群当中许多不同的声音，不要只是做个隐士型作家，只追索个人心灵中微不足道的真理。提笔写作时，应视野恢宏，胸怀"
"标注 (黄)","位置 1160","","接着，我们又坠回凡间，唯有写出的作品保留了那恢宏的洞察力。这就是为什么我们必须一而再地回到书本跟前──我指的是好书，并且一而再地阅读种种洞悉人生意义与方向的见解。我们既生而为人，就得历经这番挣扎，如此一来，我们便能一而再地对自己生出怜悯之心，并且彼此"
"标注 (黄)","位置 1171","","不管你有多么忙碌，一定要保持沉静──至少全身当中有一部分是静止的──并且搞清楚自己身在"
"标注 (黄)","位置 1175","","片桐老师说：“当下你便是佛！”只是在我们太忙，或像我朋友那样，太害怕的时候，我们便忘了这一点。因为害怕迷失方向，她于是就迷失"
"标注 (黄)","位置 1184","","就当是上午十点，也就是你当天预定开始写作的时刻，加重定时写作的压力，写一个小时或二十分钟。时间长短任你决定，不过务必全力投入，手不停地写，透过你的笔，将你血脉中的一切，统统倾注在纸上。千万别停手，别偷懒，别做白日梦，写到你精疲力竭"
"标注 (黄)","位置 1197","","句型结构显示，女性总是在寻求别人附和她们的感受和见解；她们并不是在提出声明后，便坚守声明“这很美”或“这很糟糕”。她们需要别人的"
"标注 (黄)","位置 1201","","这世界并非总是黑白分明，人不见得能确定自己可不可以去某个地方，然而务必作出清楚、斩钉截铁的声明，这一点对写作新手来讲尤其"
"标注 (黄)","位置 1204","","提出声明不啻在练习信任自己的心，学习坚持自己的"
"标注 (黄)","位置 1205","","我让自己把所有含糊、不确定的字句统统拿掉；那种感觉就像冲好澡以后，身上的浴巾硬生生被扯掉，浑身光溜溜地站着，暴露出自己真实的样貌和"
"标注 (黄)","位置 1207","","因此，纵使人生并非永远清楚分明，但清楚且肯定地提出声明表达自己的见解却是件好事。“我是这么认为和感觉的”、“眼前我就是这样的人”，这需要勤加练习，却会带来很多的"
"标注 (黄)","位置 1211","","另一个应加以注意的是问句。凡是写出来的问题，你自己都得回答出来。写作时写出了一个问句，没关系，可是你必须立即更深入挖掘自己的内心，然后在下一个句子里回答前面的"
"标注 (黄)","位置 1215","","别害怕回答问题，你将发现自己内在无穷的机智。写作是在焚尽你心灵中的迷雾，别把雾气带到纸上。就算有件事你并不是很确定，表达的时候，也得做出对自己胸有成竹的样子。如此这般地多多练习，最后你会真的"
"标注 (黄)","位置 1251","","这并不表示你在写作时，应该停下沉思一个小时，好想出一个新动词。只是要留意动词以及动词的力量，并以新的方式来运用动词。你对语言的各种面向越是注意，文笔就会越生动。到头来，你可能会认定还是用跑、看、走等一般动词比较对味。这也没关系，可是那一定得是你自己所作的选择，而不是糊里糊涂，要么在睡觉，要么在打盹的情况下写出的"
"标注 (黄)","位置 1289","","而且，我们的心灵是很狡诈的，似乎我一提笔写作，心里便会想起一百件我更想做的好玩"
"标注 (黄)","位置 1294","","你可以有不同的说法，不过，我们会使出这些小把戏，基本上是因为我们内心当中在抗拒的那一部分开始在作祟了。它想抗拒什么呢？工作和"
"标注 (黄)","位置 1295","","去年秋天，有一阵子只要我一提笔写作，脑子便一片空白，内心涌起一股安乐感；我凝视窗外，心里洋溢着大爱，觉得与万事万物融为一体。我就这样坐着，有时竟坐满了整段原本计划写作的时间。我自忖：“注意看哪，我逐渐觉悟成佛了！这比写作重要多了，何况不管写什么，目标都是想达到此一境界。”等这种情况过去了好一阵子以后，我请教片桐老师，他说：“喔，你只是在偷懒而已，好好工作"
"标注 (黄)","位置 1309","","海明威在《流动的盛宴》（这本书太棒了，快读读吧！）中谈到他在巴黎咖啡馆里写作的往事，以及当时乔伊斯说不定和他只隔了几张桌子"
"标注 (黄)","位置 1333","","那已变成逃避写作的另一个小把戏。我看过不少朋友在营造了完美空间后，根本就受不了踏进里面一步，在厨房的桌子上写东西倒还比较舒服。叫人坐在精美的空间里，摩挲着写作所带出的人生不尽完美的种种，真是谈何容易。我们打造了沉静的精美房间，却又渴望在嘈杂又凌乱的咖啡馆里写作。我们当中不少人营造了美丽又井然有序的夏日花园，却巴望着置身树林中，那里有落叶、小虫，而且看起来紊乱而荡然无序。我们的书房自然会出现翻开后未合起的书、至少一只盛着半杯旧茶水的杯子、散落的纸张、一沓沓未回的信、一个饼干盒、踢到书桌底下的鞋子，以及地板上一只分针坏掉的"
"标注 (黄)","位置 1339","","禅师都说，我们的房间显示我们的心灵状态；有些人害怕空间，所以在屋里每个角落都塞满东西。这就像是我们的心害怕空虚，因此心里时常思潮澎湃，老是想东想西。不过，我觉得写作的空间是另一回事；一点点外在的失序显现心灵的丰富多产，表示这个人创造力旺盛。一间完美无瑕的书房总是向我显示，房间的主人恐惧自己的心灵，其外在空间反映出内在的控制欲。创作正好相反，它是失去"
"标注 (黄)","位置 1370","","如果你在春情荡漾的时候写下吃甜瓜的事，即使你从未提及情色二字，我们读文章时仍会感觉春情"
"标注 (黄)","位置 1375","","一如你一直以来的期望，大胆厚颜地直挑情色题材，而且不会因此觉得恐慌或"
"标注 (黄)","位置 1379","","什么令你热情如火？ 列出你所知具有性意味的水果。 没谈恋爱时，你都吃什么？ 你身体的哪一部位最有情色意味？ “躯体变成了大地景观”──美莉朵·乐苏尔──这句话会让你联想到什么？ 你头一回感觉春情荡漾的"
"标注 (黄)","位置 1383","","记住要写得明确清楚，开始吧，让你的手不停地写，不要"
"标注 (黄)","位置 1410","","拿出另一本笔记本，抽出另一支笔，只管写，写，写。在这世界的中央，踏出积极的一步；在一团混乱的中心，采取明确的行动。只管写，持肯定的心态活下去，时时保持觉察。只管写，写，写。 最后，世上没有十全十美的事，如果你想写作，就得明白这一点并提笔开始写。没有十全十美的气氛、笔记本、笔或书桌，因此请训练自己保持弹性。试着在不同的环境和场所写作：在火车上、在巴士上、在厨房餐桌上、独自在森林中倚着树干、在溪畔把双脚泡在水里、坐在沙漠中的岩石上、在家门前马路的围栏上、在走廊上、在门阶上、在汽车后座、在图书馆、在午餐吧台、在巷子里、在职业介绍所、在牙科诊所候诊室、在酒吧的木头雅座上、在机场、在得州、在堪萨斯州或危地马拉、在啜饮可乐、抽着烟、吃着培根莴苣西红柿三明治"
"标注 (黄)","位置 1419","","当我再抬起头时，已经过了一小时，我心想：“这太完美了。”当时我的座位并不完美，可是只要我们写得热烈又专注，在哪里都无关紧要：这是种完美的状态。晓得自己无处不可写作，予人极大的自主感和安全感。只要你想写作，不论如何，你终究都会有办法可"
"标注 (黄)","位置 1435","","即使你已经推了自己一把，并觉得已有所突破，也得再推一把。 一旦往前再游出去，在浪头上能留多久便留多久。请勿半途停下，那一刻不会一模一样地重现；现在不一口气完成，以后回头再写，将耗掉你更多的"
"标注 (黄)","位置 1446","","星期二那天我觉得需要独处，想四处走走、写点东西。每个人一生中都有自己最恐惧的事物，我害怕的是寂寞。我们最害怕的事物，自然也是我们最有必要加以克服的事物，克服以后才能实现生命的"
"标注 (黄)","位置 1451","","每一回只要我觉得无所适从或茫然若失，似乎就会开始怀疑自己整个的人生，我就会变得很痛苦。为了让自己及时自拔，我会告诉自己：“娜塔莉，你本来 打算写东西的，现在就写吧，我才不管你是不是觉得混乱又寂寞。”于是我开始"
"标注 (黄)","位置 1470","","接着，就在那一章的结尾，一天深夜，他坐在校门外，内心一片宁静。就在那一刻，他接受了他的处境。他明白了，一切事物皆无好坏之分，只要活下去就是"
"标注 (黄)","位置 1471","","自我们的痛苦中出发写作，终将促使我们对自己既渺小又时时在摸索的生命产生怜悯；从此一残破的状态，恻隐之心将油然而生，我们将怜惜我们脚下的水泥地，还有在疾风中噼啪作响的干草。我们将可触及周遭的一切，我们以前觉得它们好丑，如今则看到它们特有的细节，比方剥落的油漆和灰暗的阴影──其实这就是它们的本色，没有好坏之分，且就是我们生活周遭的一部分而已。热爱生活，因为它是我们的生活，此时此刻，什么也比不上"
"标注 (黄)","位置 1482","","“呃，我会尽力而为，我觉得应该要试试看。如果没成功，也没关系，我会坦然接受。” 老师答称：“这个态度是不对的，要是有人把你打倒了，你得站起来。要是他们再一次打倒了你，你要再站起来。不管你被人打倒多少次，都得再站起来，这才是你应有的"
"标注 (黄)","位置 1486","","如果你想写作，只管写吧。如果写好了一本书却没人肯出版，那就再写一本。你会越写越好，因为你已经有过更多的练习"
"标注 (黄)","位置 1492","","别听信怀疑的声音，它没有别的用处，只会让你痛苦消极。它就像你正设法写作时，心里那个对你挑三拣四的声音：“那太愚蠢了，别那么写。你以为你是谁啊？竟然想当作家。”别去理会那些声音，它们有害无益。相反地，对你的写作要有怜爱之心与决心，保有幽默感和极大的耐心，相信自己正在做一件正确的事。不要被怀疑那只长着啮齿的小老鼠给咬到了，放眼去看看广袤无边的人生，并且对时间和练习保有"
"标注 (黄)","位置 1500","","写作也应该是这样。从一开始就应该保持美好喜悦的心情，别和写作为敌，让它变成你的"
"标注 (黄)","位置 1501","","写作是你的朋友，它永远都不会背弃你，倒是你说不定会多次背弃它。写作的过程源源不绝地带来生命和生命力，有时我从外头工作回家，心里又乱又烦，这时我便会告诉自己：“娜塔莉，你晓得你需要做什么，你需要写作。”我要是聪明的话便会听从，要是当时自暴自弃，或者正处于非常懒惰的状态中，便不会听劝，就继续忧郁下去。然而，当我确实听话时，它让我有机会探触自己的生命，这往往让我整个人变得柔软，让我得以再度拾回自我。即使我笔端写的是那天上午高峰时刻在公路上发生的细节，重温这些细节通常会赐给我一种平静与笃定的感觉。“我是个人；我早上醒来，开车上了"
"标注 (黄)","位置 1571","","我们写在当下，反映了当时心中的想法、情绪和环境。不同的回答并无真伪之分，它们都是真实"
"标注 (黄)","位置 1582","","我告诉你们这件事，因为它很重要。我们乐于每周抽出一整天的时间全身心投入写作，是因为写作、分享和友谊都具有重要"
